{"case_id":"EQ-F05-PCH-02","content_digest":"10bad3003d251dffcfb508ab507e5bfc45d841848ef7370bda2eb7c4fb896b6d","current_verdict":"UNDETERMINED","decisive_event_ids":["E2"],"decisive_evidence":"EQ-F05-PCH-02: The final replay contains the decisive holdout result. The record is available for current Verdict assessment.","defect_family":"stale instruction use","reference_verdict":"UNDETERMINED","schema_version":"1.0","task":"EQ-F05-PCH-02: replay the final isolated holdout task for the stale instruction use defect family."}
