{"case_id":"EQ-F10-DEV-01","content_digest":"b501726312d1f8bc6d023f240589d097da3bd66d3063fb28d1a8e1113adbe9a3","current_verdict":"FAIL","decisive_event_ids":["E2"],"decisive_evidence":"EQ-F10-DEV-01: The regression fixture contains the decisive failure mechanism. The record is available for current Verdict assessment.","defect_family":"correlated evaluator error or signal gaming","reference_verdict":"FAIL","schema_version":"1.0","task":"EQ-F10-DEV-01: exercise the authored regression fixture for the correlated evaluator error or signal gaming defect family."}
