{"case_id":"EQ-F02-PCH-02","content_digest":"ecf9ecaa42a388b5bc4aab476490060c248408bc9547f29f3dd862108f3cf551","current_verdict":"UNDETERMINED","decisive_event_ids":["E2"],"decisive_evidence":"EQ-F02-PCH-02: The final replay contains the decisive holdout result. The record is available for current Verdict assessment.","defect_family":"ignored tool failure","reference_verdict":"UNDETERMINED","schema_version":"1.0","task":"EQ-F02-PCH-02: replay the final isolated holdout task for the ignored tool failure defect family."}
