{"case_id":"EQ-F09-PCH-01","content_digest":"ccec2923e03d35013d7e811604a8c6bf29104189f22b976ec9a2da902168a091","current_verdict":"FAIL","decisive_event_ids":["E2"],"decisive_evidence":"EQ-F09-PCH-01: The holdout record contains the decisive post-calibration evidence. The record is available for current Verdict assessment.","defect_family":"unsupported completion claim","reference_verdict":"FAIL","schema_version":"1.0","task":"EQ-F09-PCH-01: inspect the untouched calibration holdout for the unsupported completion claim defect family."}
