{"case_id":"EQ-F02-DEV-01","content_digest":"1d0aa64858e1802205b352a2de9717d422528bd5fcbc5112658155a400f57926","current_verdict":"PASS","decisive_event_ids":["E2"],"decisive_evidence":"EQ-F02-DEV-01: The regression fixture contains the decisive failure mechanism. The record is available for current Verdict assessment.","defect_family":"ignored tool failure","reference_verdict":"PASS","schema_version":"1.0","task":"EQ-F02-DEV-01: exercise the authored regression fixture for the ignored tool failure defect family."}
