{"case_id":"EQ-F07-DEV-02","content_digest":"db56ed230dc86b833cbba5b852c8f34a28e2c0ab024aaf8e6e749ef8746ad360","current_verdict":"FAIL","decisive_event_ids":["E2"],"decisive_evidence":"EQ-F07-DEV-02: The development record contains the decisive completion evidence. The record is available for current Verdict assessment.","defect_family":"rare valid environment condition","reference_verdict":"FAIL","schema_version":"1.0","task":"EQ-F07-DEV-02: verify the development acceptance record for the rare valid environment condition defect family."}
