{"case_id":"EQ-F09-DEV-01","content_digest":"a8fc9de6268ffc9fc922d9572fe810cbb3cb63ab91a9e90e51ada6fc04de0243","current_verdict":"PASS","decisive_event_ids":["E2"],"decisive_evidence":"EQ-F09-DEV-01: The regression fixture contains the decisive failure mechanism. The record is available for current Verdict assessment.","defect_family":"unsupported completion claim","reference_verdict":"FAIL","schema_version":"1.0","task":"EQ-F09-DEV-01: exercise the authored regression fixture for the unsupported completion claim defect family."}
