{"case_id":"EQ-F06-AH-03","content_digest":"75ca133677283707eb99448873888f82c39e9394cf94dbf17a876324b3831c00","current_verdict":"FAIL","decisive_event_ids":["E2"],"decisive_evidence":"EQ-F06-AH-03: The replay output contains the decisive observed result. The record is available for current Verdict assessment.","defect_family":"rationale-evidence conflict","reference_verdict":"FAIL","schema_version":"1.0","task":"EQ-F06-AH-03: replay the isolated integration check for the rationale-evidence conflict defect family."}
