{"case_id":"EQ-F08-PCH-02","content_digest":"3c38fa41837c5a87ba1b00b292ba94895024de042c0214e7e6004a60e7fc5dbd","current_verdict":"FAIL","decisive_event_ids":["E2"],"decisive_evidence":"EQ-F08-PCH-02: The final replay contains the decisive holdout result. The record is available for current Verdict assessment.","defect_family":"ambiguous requirement","reference_verdict":"FAIL","schema_version":"1.0","task":"EQ-F08-PCH-02: replay the final isolated holdout task for the ambiguous requirement defect family."}
