{"case_id":"EQ-F01-AH-01","content_digest":"d4a6708fe38e3a7080b549d97a3dc5f6b115272115a0b4cb30c94180f8eae3f6","current_verdict":"PASS","decisive_event_ids":["E2"],"decisive_evidence":"EQ-F01-AH-01: The release audit contains the decisive repair sequence. The record is available for current Verdict assessment.","defect_family":"unusual-tool success","reference_verdict":"FAIL","schema_version":"1.0","task":"EQ-F01-AH-01: audit the release repair record for the unusual-tool success defect family."}
