{"case_id":"EQ-F04-AH-04","content_digest":"12fb4e59c5fc43ce330b941ab3b3f363930a8ac4db0267a7828cee0c01576916","current_verdict":"UNDETERMINED","decisive_event_ids":["E2"],"decisive_evidence":"EQ-F04-AH-04: The retained artifact contains the decisive acceptance evidence. The record is available for current Verdict assessment.","defect_family":"incomplete work with convincing summary","reference_verdict":"UNDETERMINED","schema_version":"1.0","task":"EQ-F04-AH-04: compare the retained acceptance artifact for the incomplete work with convincing summary defect family."}
