{"case_id":"EQ-F01-AH-03","content_digest":"76e4e2504b6925f61cfb29d12418e05feb613608c1d2aa47a6ee272c28d1c9d5","current_verdict":"FAIL","decisive_event_ids":["E2"],"decisive_evidence":"EQ-F01-AH-03: The replay output contains the decisive observed result. The record is available for current Verdict assessment.","defect_family":"unusual-tool success","reference_verdict":"FAIL","schema_version":"1.0","task":"EQ-F01-AH-03: replay the isolated integration check for the unusual-tool success defect family."}
