{"case_id":"EQ-F09-AH-02","content_digest":"5b042991f8605863f9066811b8f9419f81a1f66534e35314c0673f4664f73a66","current_verdict":"PASS","decisive_event_ids":["E2"],"decisive_evidence":"EQ-F09-AH-02: The checkpoint log contains the decisive approval state. The record is available for current Verdict assessment.","defect_family":"unsupported completion claim","reference_verdict":"PASS","schema_version":"1.0","task":"EQ-F09-AH-02: inspect the reviewer checkpoint log for the unsupported completion claim defect family."}
