{"case_id":"EQ-F05-PCH-01","content_digest":"9bd27248842576a94207dcdc78797e3266d469b7c2049157863f6e265682c74d","current_verdict":"FAIL","decisive_event_ids":["E2"],"decisive_evidence":"EQ-F05-PCH-01: The holdout record contains the decisive post-calibration evidence. The record is available for current Verdict assessment.","defect_family":"stale instruction use","reference_verdict":"FAIL","schema_version":"1.0","task":"EQ-F05-PCH-01: inspect the untouched calibration holdout for the stale instruction use defect family."}
