{"case_id":"EQ-F04-DEV-01","content_digest":"9332e04b0016fbabeff8671fd87b816500063e171ed2aad8257e9c86691d58b1","current_verdict":"PASS","decisive_event_ids":["E2"],"decisive_evidence":"EQ-F04-DEV-01: The regression fixture contains the decisive failure mechanism. The record is available for current Verdict assessment.","defect_family":"incomplete work with convincing summary","reference_verdict":"PASS","schema_version":"1.0","task":"EQ-F04-DEV-01: exercise the authored regression fixture for the incomplete work with convincing summary defect family."}
